{
  "selected_alternative_id": "A3",
  "selection_rationale": "A3 is the best overall choice because it satisfies all stated requirements while preserving the simplest deployable shape, which makes it the strongest fit when requirement satisfaction is prioritized first, then drivers, then quality attributes, trade-offs, and risks. Compared with A1, it adds fresher rider/admin views through internal evented projections; compared with A2, it avoids the highest operational complexity and the consistency penalties of a distributed system. A3 therefore offers the best balance of compliance, usability, responsiveness, and maintainability without taking on microservices-level complexity.",
  "adr_markdown": "# ADR: Modular Monolith with Internal Evented Projections and CQRS\n\n## Status\n\nAccepted\n\n## Context\n\nThe system must support rider and administrator experiences for a bike-rental platform while meeting security, privacy, compliance, reporting, and responsiveness needs. The selected architecture must handle authenticated access, verification and payment flows, rental lifecycle management, bike availability updates, and historical reporting without introducing unnecessary operational complexity.\n\nThe decision also needs to balance cross-channel access, centralized consistency for rental and billing workflows, and timely read access for discovery and reporting. The evaluated options show a spectrum from a simple modular monolith to a fully distributed microservices architecture. The chosen approach should preserve deployment simplicity while still improving freshness of rider and administrator views.\n\n## Decision\n\nAdopt alternative A3: a modular monolith organized with hexagonal boundaries, internal event publication, CQRS-style read models, and internal process coordination for rental and payment workflows.\n\nThis decision keeps the system as a single deployable application with clear business modules and isolated adapters, while using internal events and specialized projections to improve discovery, availability, and reporting reads. Core transactional workflows remain centralized within the application boundary.\n\n## Rationale\n\nA3 was selected because it satisfies all stated requirements while offering the best overall balance of simplicity, freshness of reads, and operational prudence.\n\nFrom the evaluation, A3 meets the functional requirements for registration, authentication, rental management, payment handling, timeout behavior, history retention, and administrative reporting. It also aligns well with the major architectural drivers: security and privacy, cross-channel access, user experience simplicity, time-sensitive rider interactions, and operational reporting.\n\nCompared with A1, A3 improves rider and administrator view freshness by introducing internal evented projections, while still retaining the single deployable boundary and centralized consistency advantages of a monolith. Compared with A2, it avoids the higher complexity, heavier operational burden, and stronger consistency trade-offs of a distributed system.\n\nThe trade-off analysis shows that A3 is a pragmatic middle ground: it improves responsiveness and reporting without paying the full cost of microservices. The main remaining compromises are projection complexity and the fact that scalability and fault isolation are still bounded by a single application runtime.\n\n## Alternatives Considered\n\n### A1 - Modular Monolith with Hexagonal Architecture, API Gateway, and Saga / Process Manager\n\nA1 proposed a single deployable modular application with hexagonal boundaries, an API gateway, and centralized workflow coordination.\nIt was not selected because, although it is strong on simplicity and consistency, it provides weaker freshness for discovery and reporting than A3. The evaluation and trade-off analysis indicate that A3 better serves time-sensitive rider interactions and administrative views through internal event-driven projections.\n\n### A2 - Distributed Microservices with Event-Driven Integration\n\nA2 proposed a set of independently deployable services with asynchronous integration and stronger fault isolation.\nIt was not selected because it introduces the highest architectural and operational complexity and weakens consistency relative to the other options. The evaluation highlights that the platform does not need microservices-level distribution to satisfy its requirements, and the trade-off analysis shows the added coordination, monitoring, and testing burden would be disproportionate.\n\n## Consequences\n\n### Positive Consequences\n\n- Preserves the simplicity of a single deployable application.\n- Maintains strong transactional consistency for rental and billing workflows.\n- Improves rider discovery and administrator reporting through fresher read models.\n- Supports security and compliance through clear internal boundaries and isolated adapters.\n- Provides a pragmatic architecture that can evolve further if demand increases.\n\n### Negative Consequences\n\n- The system still has less fault isolation and elastic scaling than a distributed architecture.\n- Internal event publication and projection maintenance add design and testing complexity.\n- Read models can become temporarily stale if projection processing lags.\n- A monolith-wide runtime failure can impact many user flows at once.\n- Future growth may require later service extraction, creating migration cost.\n\n## Traceability\n\n- Requirements: S1, S2, S3, S4, S5, S6, S7, S8, S9, S10, S11, S12, S13\n- Quality attributes: security and privacy, usability, availability, performance and responsiveness, data consistency, interoperability, localization and regulatory compliance\n- Architectural drivers: security, privacy, and regulatory compliance; cross-channel access for riders and administrators; user experience simplicity; time-sensitive rider interactions; operational reporting and history retention",
  "architecture_diagram_mermaid": "flowchart LR\n  %% External actors\n  Rider[Rider]\n  Admin[Administrator]\n  PaymentProvider[Payment Provider]\n  NotificationSvc[SMS / Email Service]\n  MapSvc[Mapping / Geolocation Service]\n\n  subgraph App[Modular Monolith - Single Deployable Boundary]\n    Gateway[API Gateway]\n\n    subgraph Security[Security & Access]\n      Auth[Authentication & Session Handling]\n    end\n\n    subgraph Rental[Rental Workflow]\n      RentalSvc[Rental and Booking Coordination]\n      PaymentCoord[Payment Coordination]\n      ProcessMgr[Internal Process Manager]\n    end\n\n    subgraph Domain[Domain & Integration Boundaries]\n      BikeMgmt[Bike Availability & Inventory]\n      EventBus[Internal Domain Event Bus]\n      Adapters[Hexagonal Adapters]\n    end\n\n    subgraph ReadSide[CQRS Read Models]\n      RiderRead[Rider Discovery Read Model]\n      AdminRead[Admin Reporting Read Model]\n      History[Usage History & Reporting Store]\n    end\n  end\n\n  Rider -->|HTTP/REST| Gateway\n  Admin -->|HTTP/REST| Gateway\n\n  Gateway --> Auth\n  Gateway --> RentalSvc\n  Gateway --> BikeMgmt\n  Gateway --> History\n\n  Auth --> RentalSvc\n  RentalSvc --> PaymentCoord\n  RentalSvc --> ProcessMgr\n  RentalSvc --> EventBus\n  BikeMgmt --> EventBus\n  ProcessMgr --> EventBus\n\n  EventBus --> RiderRead\n  EventBus --> AdminRead\n  EventBus --> History\n\n  PaymentCoord -->|adapter integration| Adapters\n  Adapters -->|HTTP/API| PaymentProvider\n  Adapters -->|HTTP/API| NotificationSvc\n  Adapters -->|HTTP/API| MapSvc\n\n  RiderRead -->|query access| Gateway\n  AdminRead -->|query access| Gateway\n  History -->|query access| Gateway"
}
